{
  "schema_version": 2,
  "project": "backoffice",
  "recipe": "GP-02",
  "recipe_version": "1.0.0",
  "components": [
    {
      "boilerplate": "tanstack-admin",
      "pin": "e6e5d3bdb7974d4a2283df763ea2dd222d82e1f0",
      "destination": "apps/admin",
      "surface": "web-admin",
      "materialization": {
        "strategy": "copy",
        "adapter_fingerprint": "72bdb46da4bd38d0013d14b95841fd10fe0d90565ace78ad8d43313c91300617"
      }
    }
  ],
  "database_profile": "postgresql-managed",
  "operations": [
    "materialize apps/admin from tanstack-admin@e6e5d3bdb7974d4a2283df763ea2dd222d82e1f0"
  ],
  "setup": [
    "provision database profile postgresql-managed"
  ],
  "checks": [
    "typecheck",
    "auth-smoke"
  ],
  "fingerprint": "0606ace79494013277e568baab56c17b2e5605d856e694f457b9ab91f48c1833"
}
