{
  "schema_version": 2,
  "project": "field ops",
  "recipe": "GP-06",
  "recipe_version": "1.0.0",
  "components": [
    {
      "boilerplate": "tanstack-admin",
      "pin": "e6e5d3bdb7974d4a2283df763ea2dd222d82e1f0",
      "destination": "apps/admin",
      "surface": "web-admin",
      "materialization": {
        "strategy": "copy",
        "adapter_fingerprint": "72bdb46da4bd38d0013d14b95841fd10fe0d90565ace78ad8d43313c91300617"
      }
    },
    {
      "boilerplate": "tanstack-transactional-pwa",
      "pin": "f2571ea8efb2e5a2ceaaafa7ff38c523dca1ac0c",
      "destination": "apps/mobile",
      "surface": "mobile-native",
      "materialization": {
        "strategy": "copy",
        "adapter_fingerprint": "72bdb46da4bd38d0013d14b95841fd10fe0d90565ace78ad8d43313c91300617"
      }
    },
    {
      "boilerplate": "hono-api",
      "pin": "360eb274cc5936fee5aab88eb8bd94977e95dfc9",
      "destination": "services/api",
      "surface": "api",
      "materialization": {
        "strategy": "generate",
        "name": "field-ops-api",
        "profile": "authenticated",
        "arguments": ["--profile=authenticated"],
        "adapter_fingerprint": "0008138a8d464d3ac3dcc5c2a2236d7a501c22cf55478ef387c006789a2d79be"
      }
    }
  ],
  "database_profile": "postgresql-managed",
  "operations": [
    "materialize apps/admin from tanstack-admin@e6e5d3bdb7974d4a2283df763ea2dd222d82e1f0",
    "materialize apps/mobile from tanstack-transactional-pwa@f2571ea8efb2e5a2ceaaafa7ff38c523dca1ac0c",
    "materialize services/api from hono-api@360eb274cc5936fee5aab88eb8bd94977e95dfc9 [generate profile=authenticated]"
  ],
  "setup": ["provision database profile postgresql-managed"],
  "checks": ["contract-test", "typecheck", "auth-smoke"],
  "fingerprint": "58a020a30b83e09bd1571974877627eaa494887e4e047fbdc47dbffcbc3a28e7"
}
